spans,text
"[53, 54, 55, 56, 57, 58]",And Americans wonder why they are seen as the worlds idiots.
"[49, 50, 51, 52, 53, 54, 55, 56]","Right back at you - and verifiable facts please. Paranoia and inability to control emotions are two of the most common defining factors of right wing nuts. That and projection and finger pointing. Oh, & lack of personal accountability, hypocrisy, denial...gosh, I could go in for days. But I won't.

You know Trump Bunny, my use of the word ""direct"" refers to the negative effect his ""leadership"" has had on America & the world. Trump is a bully, a liar, a purveyor of and dealer in hate, chaos, lies, homophobia, racism, bigotry, misogyny, hypocrisy, greed, violence, nihilism, & just about every despicable trait known to mankind.

We already know that statistically the number of violent hate crimes in America has increased since Trump took office. The numbers of people seeking mental health services because of Trump-related stress has been reported by mental health providers, at the same time his ""healthcare"" plan will limit mental health treatment options, substance abuse funding & so on."
"[62, 63, 64, 65]","Because 13 plants are DANGEROUS.  SMDH.

Grow the hell up you damn cowardly children."
"[26, 27, 28, 29, 30, 31]","Oh sparkle, stick to your stupid comments and keep away from homophobic humor."
"[59, 60, 61, 62, 63, 64]",The Democrat party is like a dog sniffing its own tail. It stinks.
"[11, 12, 13, 14, 15]",&23million fools follow him.
"[4, 5, 6, 7, 8, 9, 10, 11, 57, 58, 59, 60, 61, 62, 63, 107, 108, 109, 110, 111]","The insolent politicians of Puertorico accusing the US :“killing us with the inefficiency”. These derelict fools are the inefficient ones, totally failing at any intelligent response a civilized country should have when disaster strikes."
"[31, 32, 33, 34, 35, 36, 37]","Trump is a mentally unbalanced buffoon.
He's unfit for office.
He's the largest threat to our nation's security and Congress should exercise it's responsibility and remove him now.
He's a petty con man, a racist supremacist, a sexual predator and a traitor.
Worst ever."
"[10, 11, 12, 13, 14]",Socialist troll
"[19, 20, 21, 22, 23, 24, 25, 26, 27]",That has to be the stupidest rebuttal I have ever seen on this forum.
"[54, 55, 56, 57, 58, 59]","Katebat...there are so many CNN and Obama brainwashed idiots that still claim victory when they a placed under a rock.  This Russian thing will go no where and will eventually spell the end of Obama, the Clintons, the last AG...what's her name?  Also, the rest of the corrupt donkeys of the former administration."
"[0, 1, 2, 3, 4, 5, 6, 7, 8, 9, 10, 11, 12, 13, 14, 15, 16]","Don't be ignorant, educate yourself.  Politics is not a protected class."
"[19, 20, 21]","your liberal lying ass is whats wrong with America today. I hope hillary is in jail by nov 9. and what about guns? Are you a freak, or what?"
"[21, 22, 23, 24, 25]","Hum, ah, hum I am an idiot, worlds from JT to live by"
"[30, 31, 32, 33, 34, 35, 36, 37]",Nice clickbait title and then bullshit article.  Terrible journalism.
"[11, 12, 13, 14, 15, 16, 17, 18, 19, 20]",CROOKS and disgusting !
"[16, 17, 18, 19, 20, 21, 22, 23, 24, 25, 26, 27, 28, 29, 30, 31, 32, 33]",Give a rest you old communist fool.  Florida and Texas have large populations of blacks and Hispanics.
"[295, 296, 297, 298, 299, 300, 301, 302, 303]","And the greatest check and balance is a well informed electorate that pays attention as to how their leaders rule and when appropriate reelect those who lead the way the people wish while occasionally putting a prudently applied kibosh to those who reign with malice, malfeasance, or just plain stupidity."
"[278, 279, 280, 281, 282, 283]","No, that's your job. You right wing nut jobs positively revel in your ignorance, as does your incompetent, exceptionally ignorant pick to run the country into the ground.  You're the ones that should be deported.  Out with the stupid.  That will come soon enough. This level of stupid can't be sustained for long."
"[33, 34, 35, 36, 37, 38]","Funny, usually attorneys are the clowns."
"[198, 199, 200, 201, 202, 203]","20 million ""motor voter"" votes were cast and counted.  They ALL went Demo-liberal.  I'm being VERY generous in proposing only 5 of 20 million cast, were illegals.  Of course they voted, they're not idiots.  Stick your head back in the sand, I'm sure it's comforting."
"[54, 55, 56, 57, 58]","Obviously, Laura Mulligan's statement proves she's an idiot. There should be a policy of letter rejection if the first sentence demonstrates imbecility on the part of the writer."
"[14, 15, 16, 17, 18, 19, 20, 21, 22, 32, 33, 34, 35, 36]","'
Trump is an imbecilic vacuous idiot.

In his case, open-minded means utterly empty headed.

.
…he's also a petulant and childish belligerent buffoon,

…and a petty con man.

.
The trumpery is watching his con game unfold before their eyes and denying what they see.
.
They still refuse to believe they've been played for the marks and patsies in Trump's hustles and cons.
.
(I'm putting all my investments in the soon-to-be-booming environmental disaster cleanup sector.)

."
[],Find them and cut their arms off. No mercy.
"[18, 19, 20, 21, 22, 23, 24, 25, 26, 27, 28, 29, 30, 31, 32]",A meeting between dumb and dumber.
"[29, 30, 31, 32, 33, 34, 35, 36]","Wig
How sad it is. Canada is pathetic. Canada has tied itself to the world's bully. The bully attacks weak countries and Canada joined it in Afghanistan and subsequent. The US has yet to win a war.
American and Canadian citizens should be ashamed of ourselves.."
"[61, 62, 63, 64, 65, 66, 67, 68, 69, 70, 71, 72, 73]","Feral cats do not belong in the wild, thus the term 'feral'. Kill them all."
"[39, 40, 41, 42, 43, 44, 45]",So we're supposed to respect murderous racists?
"[171, 172, 173, 174, 175]","Based on your posts , I'm hoping most cops wouldn't spit on you if you were on fire. Who really cares what your trust is with cops, you appear to be a disgruntled, bitter idiot with a keyboard"
"[10, 11, 12, 13, 14, 15]",Plenty of stupid Alaskans do similar things.
"[67, 68, 69, 70, 71]","Trump -----> Making a game show out of Washington

What a complete idiot."
"[16, 17, 18, 19, 20, 21, 22, 23, 206, 207, 208, 209, 210, 211, 212, 213]","and yet another ignorant propaganda believing alt left sheep,, no loser trump is making great progress regardless of the lunatic opposition fromtthe dems.. .. no one is saying  attack iran but as usual you lunatics make up anything for fake news accusations. .the world needs to ignore brainless sheep like you"
"[111, 112, 113, 114, 115, 116, 117, 118, 119, 120]",And the media who endlessly refused to call him on it and are now constantly at Trump's throat are even bigger hypocrites.
"[11, 12, 13, 14, 15, 94, 95, 96, 97, 98, 99, 100]","Yeah, this idiot is selling Canada to China. in the soon future, Canada will be controlled by fucking China."
"[282, 283, 284, 285]","And Trump blames Obama for that, not Putin.   Trump thinks Putin will now respect him?   Not going to happen.  There's a reason Putin worked hard to discredit Hillary and to elect Trump - and it's not because Putin wants a strong America;  in fact, quite the opposite.   Trump is a fool."
"[20, 21, 22, 23, 24, 25]",Proof you can't fix stupid!
"[0, 1, 2, 3, 4, 5, 6, 7, 8]",Stupidity on both ends. Never violate the 180 rule.
"[285, 286, 287, 288, 289]","If you truly believe this country is rooting for trump, you need your head examined. The only thing we are rooting for is for Mueller to box him in a corner and fry him for the whole world to see.

Trump doesn't have the mental capacity of my dog. It's hard to rally around a divisive moron."
"[203, 204, 205, 206, 207, 208, 211, 212, 213, 214, 215, 216, 217, 218, 221, 222, 223, 224, 225, 226, 227, 228, 231, 232, 233, 234, 235, 236, 684, 685, 686, 687, 688, 689, 690, 691, 692, 693, 694, 695, 696, 697, 698]","This is the key insight with Trump. 

He’s just genuinely one of the worst human being imaginable. 

If you think of amost *any* character trait – not even in politics, just in life – he’s awful. 

He’s stupid, ignorant, arrogant, racist, lacks any compassion, insulting, has no sense of reciprocity. 

He doesn’t care about the rule of law. 

He openly praises tyrants and despises democrats. 

He is openly wasteful and hateful but demands that no one take a cent from him or insult him in any way. 

Never earned anything, inherited his wealth. 

He only ever punches down, and only ever uses his power to aggrandize and help himself, never to help others. 

Not to mention he’s a sexual predator who has run through trophy wifes and appears to have raised monstrous children."
"[74, 75, 76, 77, 78, 79, 80, 81, 82, 83, 84, 686, 687, 688, 689, 690, 691]","It's is probably more common than you realize having experience and still screwing up.  My ex was in the AF and his job was combat arms training and maintenance (CATM).  He was emptying out his gun one day, but got distracted.  He thought he had cleared his weapon and so he fired the gun pointing at the car.  The bullet ricocheted off the trunk and out the window in the direction of people standing outside.  One of his fellow CATM members once thought he had cleared his weapon and so pulled the trigger.  He was in his truck and I think he shot his radio.  You'd think an AF Cop would know how to drive, but one hit me on Elmendorf AFB causing $5k in damage.  Military can be very stupid too."
"[89, 90, 91, 92, 93, 94, 95, 96, 99, 100, 101, 102, 103, 104, 105, 106, 107, 108, 109, 110, 111, 112, 113, 114, 115, 116, 117]","Trump has a lot to learn about everything - he is unfortunately for us and the world, an ignorant, bullying narcissist."
"[59, 60, 61, 62, 63]",That's rich coming from a country that elected the village idiot for PM.
"[81, 82, 83, 84, 85, 86, 116, 117, 118, 119, 120, 121, 122, 151, 152, 153, 154]",Guaranteed could have deployed an SAP payroll system in the amount of time these losers have been trying to fix the garbage. Somebody needs to explain sunk cost to the uninformed.
"[225, 226, 227, 228, 229, 230]","Am I still asleep or did Steve Bannon actually say all this? I may have to re-think my opinion of him. He's dead on, of course, about there being no military solution to North Korea AND that white nationalists are a bunch of clowns."
"[0, 1, 2, 3, 4, 5, 6, 7, 8, 9, 10, 11, 12, 13, 14, 15, 16, 17, 18, 19, 20]",Pathetic little fashy.
"[120, 121, 122, 123, 124, 125, 317, 318, 319, 320, 321, 322]","We'll tell your family this when you flip your truck into a river because you think going fast makes you some kind of a badass. ""Sorry kids, your dad just thought he was really important, above the law, and didn't know how to follow rules, or be anywhere on time."" 

Seriously? People that speed just read like giant idiots."
"[12, 13, 14, 15, 16]",Photobucket sucks anyways.  Too many advertisments.
"[110, 111, 112, 113, 114, 115, 116, 117]","your heroes are all going to prison. you should join them, traitor, for all your work helping to enable these criminal scum."
"[889, 890, 891, 892, 893]","His crash is under way. The most glorious and horrendous political crash in modern history. You say that his supporters are firmly entrenched to support him. He is their leader, their Hitler, their Stalin. But there are a huge number of people who voted him that weren't those nutcases. They were bitter and angry ""average Americans"" and ""tried something new."" They are immediately streaming away from support of Trump's presidency - by the millions each and every day. Only three weeks in to his time of ""rule."" Don't get too optimistic el Duque and I am hoping that the millions who love him won't ruin their country by ""screaming"" their points for years and years afterward. An embarrassment for America worldwide - except maybe in Moscow. Look at today's polls. Trump is crashing AND despised by the media. You will be horribly disappointed when he is ""politically"" dead. A modern-day demon."
"[0, 1, 2, 3, 4, 5, 6, 7, 8, 9, 10, 11, 12, 13, 14, 15, 16, 17, 18, 19, 20, 21, 22, 23, 24, 25, 26, 27, 28, 29, 30, 31, 32, 33, 34, 35, 36]",Fool Trudeau opened the Pandora's box.
"[28, 29, 30, 31, 32, 33, 34]",Their is so much additional garbage tagged on everybill that the Its dishonest to just say LGBT was voted down how about telling us what other bull was shoveled into the bill
"[26, 27, 28, 29, 30, 31, 32, 78, 79, 80, 81, 82]",This resident of Sarasota loves them.  Best snowbirds we have.  Don't let one idiot president stop you from coming.
"[8, 9, 10, 11, 12, 13, 14, 123, 124, 125, 126, 127]","Dear Mr Maimane,

I cannot tell you how to feel about Helen Zille's silly tweet. 

I can say that you breathed life into a silly tweet and turned it into a Frankenstein. That was a mistake, far outweighing her error. 

You armed the DA's enemies and harmed its friends. 

Will you apologise, too?"
"[503, 504, 505, 506, 507, 508, 509, 510, 511, 512, 513, 733, 734, 735, 736, 737, 738, 739, 740, 741, 742, 743, 744, 745, 746, 747, 748, 918, 919, 920, 921, 922, 923, 924, 925, 926, 927, 928, 929, 930, 931, 932, 933, 934, 935, 936, 937, 938, 939, 940, 941, 942, 943, 944, 945, 946, 947, 948, 949, 950, 951, 952, 953, 954, 955, 956, 957, 958, 959, 960, 961, 962, 963, 964, 965, 966, 967, 968, 969, 970, 971, 972, 973, 974, 975, 976, 977, 978, 979, 980, 981, 982, 983, 984, 985, 986, 987, 988, 989, 990, 991]","Right!  And our federal government is just overrun with such ""honorable"" people who never ever lie!  When more than half of US States recognize the medical and far-safer-than-alcohol recreational use of cannabis, then its only a matter of time before the criminal abuse of US citizens will end. Cannabis is now the cash cow of the judicial system and its multiple private contractors, such as prison corps. Hopelessly outdated information that a minority hopes that with repetition will come true, is a fool's game. Belief in the 80+ year old ""Reefer Madness"" propaganda ignores the reality of the benefits and safety of cannabis that has been proven scientifically over and over again. Even the Feds know this but big money creates filthy hypocrisy. Ignoring proof of modern pharmacology and global medical studies merely delays the inevitable, and costs us all mega bucks and individual freedom. Can't figure out if this minority are control freaks, need psych care or are just plain stupid."
"[163, 164, 165, 166, 167, 168, 169, 170, 171]",In your book it's OK to make fun of someone's ethnic last name because you hold socially accepted bigoted views towards their ethnicity. You are a giant throbbing hypocrite & bigot!
"[421, 422, 423, 424, 425, 426, 427, 428, 429, 430]","When will Trudeau apologize for his father being the only Prime Minister in Canadian history to invoke the War Measures Act (illegally as there was no apprehended insurrection according to Mitchell Sharpe in explaining the situation to the British) and having over 450 people thrown in jail will only about 60 were ever changed with an offence?
The human rights of every Canadian were eliminated in one foul move by that egocentric power-hungry man."
"[37, 38, 39, 40, 41, 42, 49, 50, 51, 52]",I always smile when I've been called stupid by a fool.
"[45, 46, 47, 48, 49]","Masina knows he has said too much, acted the idiot mayor.... and that if Mrs Zuma isn't elected, he will be culled pdq!"
"[0, 1, 2, 3, 4, 5, 6, 7, 10, 11, 12, 13, 14, 15, 16, 17, 19, 20, 21, 22, 23, 24, 25, 26, 27, 28, 29, 30, 31]","Shameful, arrogant selfish child."
"[0, 1, 2, 3, 4, 5, 6, 7, 8, 9, 10, 11, 12, 13, 14, 15, 16, 17, 18, 19, 20, 21, 22, 23, 24, 25, 26, 27, 28, 29, 30, 31, 32, 33, 34, 35, 36, 37, 38, 39, 40, 41, 42, 43, 44, 45, 46, 47, 48, 49, 50, 51, 52, 53, 54, 55, 56, 57, 58, 59, 60, 61, 62, 63, 64, 65, 66, 67, 68, 69, 70, 71, 72, 73, 74, 75, 76, 77, 78, 79, 80, 81, 82, 83, 84, 85, 86, 87, 88, 89, 90, 91, 92, 93, 94, 95, 96, 97, 98, 99, 100, 101, 102, 103, 104, 105, 106, 107, 108, 109, 110, 111, 112, 113, 114, 115, 116, 117, 118, 119, 120, 121, 122, 123, 124, 125, 126, 127, 128, 129, 130, 131, 132, 133, 134, 135, 136, 137, 138, 139, 140, 141, 142, 143, 144, 145, 146, 147, 148, 149, 150, 151, 152, 153, 154, 155, 156, 157, 158, 159, 160, 161, 162, 163, 164, 165, 166, 167, 168, 169, 170, 171, 172, 173, 174, 175, 176, 177, 178, 179, 180, 181, 182, 183, 184, 185, 186, 187, 188, 189, 190, 191, 192, 193, 194, 195, 196, 197, 198, 199, 200, 201, 202, 203, 204, 205, 206, 207, 208, 209, 210, 211, 212, 213, 214, 215, 216, 217, 218, 219, 220, 221, 222, 223, 224, 225, 226, 227, 228, 229, 230, 231, 232, 233, 234, 235, 236, 237, 238, 239, 240, 241, 242, 243, 244, 245, 246, 247, 248, 249, 250, 251, 252, 253, 254, 255, 256, 257, 258, 259, 260, 261, 262, 263, 264, 265, 266, 267, 268, 269, 270, 271, 272, 273, 274, 275, 276, 277, 278, 279, 280, 281, 282, 283, 284, 285, 286, 287, 288, 289, 290, 291, 292, 293, 294, 295, 296, 297, 298, 299, 300, 301, 302, 303, 304, 305, 306, 307, 308, 309, 310, 311, 312, 313, 314, 315, 316, 317, 318, 319, 320, 321, 322, 323, 324, 325, 326, 327, 328, 329, 330, 331, 332, 333, 334, 335, 336, 337, 338, 339, 340, 341, 342, 343, 344, 345, 346, 347, 348, 349, 350, 351, 352, 353, 354, 355, 356, 357, 358, 359, 360, 361, 362, 363, 364, 365, 366, 367, 368, 369, 370, 371, 372, 373, 374, 375, 376, 377, 378, 379, 380, 381, 382, 383, 384, 385, 386, 387, 388, 389, 390, 391, 392, 393, 394, 395, 396, 397, 398, 399, 400, 401, 402, 403, 404, 405, 406, 407, 408, 409, 410, 411, 412, 413, 414, 415, 416, 417, 418, 419, 420, 421, 422, 423, 424, 425, 426, 427, 428, 429, 430, 431, 432, 433, 434, 435, 436, 437, 438, 439, 440, 441, 442, 443, 444, 445, 446, 447, 448, 449, 450, 451, 452, 453, 454, 455, 456, 457, 458, 459, 460, 461, 462, 463, 464, 465, 466, 467, 468, 469, 470, 471, 472, 473, 474, 475, 476, 477, 478, 479, 480, 481, 482, 483, 484, 485, 486, 487, 488, 489, 490, 491, 492, 493, 494, 495, 496, 497, 498, 499, 500, 501, 502, 503]","CivilBot
Says:
Greetings! I've detected some questionable ""civil/uncivil"" votes from your account when reviewing the comments of others. Trustworthy ""civil/uncivil"" ratings are important for our community; accounts with patterns of unfair voting will be restricted.
----------------------------------------------------------------------------------------------------------
Just what are you inferring with such generalities as posted above?
Give me some examples, please...
Anybody else getting this crap?"
[],"""Bell’s attorney, Jeffrey Griffith, said Bell,... is looking forward to fighting the allegations.""   Yeah, I'll bet he's looking forward to it.....just like going to the dentist or having a colonoscopy.  Such stupid lawyer talk!!"
"[182, 183, 184, 185, 186, 187]","How can you tell which of the bodies in the water is not a tourist?  I was born and raised here, and I can't tell the difference!  However...if they are locals, then they just plain stupid!"
"[82, 83, 84, 85, 86, 87, 88, 89, 90, 91, 92, 93, 94, 95, 96, 97]","I have a great idea, Newberry, you America-hating cosmopolitan commie: Why not go shit in your hat?"
"[19, 20, 21, 22, 23, 24, 25, 26, 27, 28, 29, 30]","Janet is a caring ""useful idiot"", to use Stalin's term and in doing so is hurting Canada. She should be charged with aiding and abetting a criminal enterprise."
"[48, 49, 50, 51, 52, 53, 54, 55, 147, 148, 149, 150, 151, 152, 153, 154, 235, 236, 237, 238, 239, 240, 241, 242, 243, 244, 245, 246, 247]","""It can't possibly be related in any way to the illegals living in the state."" You were being facetious when you said this, meaning that you blame illegals for the crime in this state. You don't have to be explicit with me. Yep, those damn illegals--the best excuse for your failed life since sliced white bread"
"[143, 144, 145, 146, 147]","The difference is that Washington and Jefferson weren't traitors, the didn't fight against the legitimate United States government, Trump's an idiot who apparently has never read a book nor learned about the Civil War."
"[10, 11, 12, 13, 14, 15, 16, 17, 18, 19, 20, 21, 22, 28, 29, 30, 31, 32]",Right all conservatives are fools and that's ok to say - Liberal hypocrisy at it's finest
"[146, 147, 148, 149, 150, 151, 152, 196, 197, 198, 199, 200, 201, 202]","It's a God made, natural plant, that makes people feel happy. How can anyone prohibit a happiness inducing plant?? Anyone that locks someone in a fucking cage for growing or smoking a flower is a fucking criminal!"
"[0, 1, 2, 3, 4, 5, 6, 7]",Bullshit.
"[948, 949, 950, 951, 952, 953]","Hilarious reading all of these comments from people who have never paid a tax to support our state government for their entire lives (unless you go back to 1980)!  These same people complain about the free thousand bucks we all received last week (thanks to oil) not being enough! ""Give me a thousand more bucks because I deserve it!""  What are we, a welfare state?  Socialists? ""No, we are an owner state.""  Whatever. 

Plain and simple, if you tax more of something, you will get less of it. Want less oil and fewer jobs? Tax oil more and see the results. We are already struggling because Alaska is such an expensive place to do business given our climate, lack of infrastructure, ENGOs, etc. Moriarty hits the nail on the head and reasonable people will appreciate her column. 

Meanwhile, these same people that complain about their money for nothing want to tax everyone but themselves in order to maintain our state services.  You can't fix stupid."
[],"Another fine upstanding citizen..let's just execute this pile of crap, he has no benefit to society."
"[8, 9, 10, 11, 12, 13, 14, 15, 16, 17, 18, 19, 20, 21, 22, 23, 24, 25, 26, 27, 28]","""Girl""? Demeaning sexist pigs . . . it's the current year!"
"[28, 29, 30, 31, 32, 33, 34, 35]","That's a totally absurd and ignorant analysis.  Mainly because it's built on the completely false assumption that Kim won't be working and making money if not for this job.  Fact is that he already has other projects in the works, and will likely get other offers on top of that, now that he is free of the 5-0 commitment."
"[15, 16, 17, 18, 19]",Not a joke you bitch
"[42, 43, 44, 45, 46, 47, 48, 49, 50, 51, 52, 53, 54, 55, 56, 57, 58, 59, 60, 61, 62, 63, 64, 65, 66, 67, 68, 69, 70, 71, 72, 73, 74, 75, 76, 77, 78, 79, 80, 81, 82, 83, 84, 85, 86, 87, 88]","FTP system Harper worked so hard to rig?

What a ridiculous and likely libelous statement."
"[7, 8, 9, 10, 11, 12, 193, 194, 195, 196, 197, 198, 199, 200, 201, 202, 203, 204, 205, 206, 207, 208]","What a stupid recommendation to not to do anything. Today, sad thing is most left leaning and liberal political parties and academia are scared to pinpoint the real problem. The problem is the Islamic ideology. Long term solution is not to allow Muslims into west and lock away for life anybody who has engaged in any terrorists activities. Terrorists family should be made to pay for the terrorists damages."
"[18, 19, 20, 21, 22, 23]","I'll ignore your ""stupid"" insult and reply anyway... 

No, the point isn't to be an average team that has a hot streak somewhere in the season that gives them a record where they barely hang on and steak into the playoffs.  The point is to be a good team PERIOD that can win most of their games not just during a hot streak anomaly, but throughout most of the season and in the playoffs.  You seem to have completely missed that nuance of my comment.  

Of course it's better to make the playoffs than not make the playoffs.  Of course it's better to have a hot streak than not have a hot streak.  But my point was that aside from that early hot streak, they were an average-at-best team for most of the season.  The early hot streak was the anomaly.  The sub-.500 team we saw after that is what they were for most of the season and heading into the playoffs."
"[10, 11, 12, 13, 14]","You're an idiot, another left-wing troll..."
"[552, 553, 554, 555, 556, 557, 558, 559, 560, 561, 562, 563, 564, 565, 566, 567, 568, 569, 570, 571]","""Mr. Pinsonneault( National Bank) said the ratio has now climbed back to its long-term average level of 2.5 per cent.....which suggests the market is in balance in the region, limiting the risk of a significant further price correction.""
____
Are you fore real? What you are saying makes absolutely no sense! Find some other stat to warp to try and pump up the RE market. I guess your flawed Tetranet-NB Index is not enough!

Pretty sure you did this interview by the phone, it would be impossible not to turn red or laugh out loud as you present your ridiculous ""analysis""."
"[35, 36, 37, 38, 39, 40, 252, 253, 254, 255, 256, 257, 427, 428, 429, 430, 431, 432, 433, 434, 435]","Yeah, fake in the sense that these idiots (you?) support the Dolt-in-Chief, support legislation that can be demonstrated to harm many Americans, and have so little respect for American democratic institutions that you support a candidate who willingly hooked up with a foreign government in order to win an election. It's disgusting and most Americans--the majority, rather than the minority that elected Trump--are rightfully disgusted."
"[269, 270, 271, 272, 273, 274, 275, 276, 277, 278]","How many Jewish-majority countries are there in the world?  One, with a total population of barely 10 million.

And that country is a constitutional democracy, with full rights and freedoms for all its people, including those who aren't Jewish.

Sorry, your analogy is ridiculous."
"[27, 28, 29, 30, 31, 32]","You call 60 million people stupid because of a vote. Wow, you exemplify the exact reason I don't get along with 80% of liberals. Just keep calling us names. It's the only method debate most liberals have."
"[18, 19, 20, 21, 22, 23, 24, 25, 26, 27, 28, 29, 30, 31, 32, 33, 34, 35, 36, 37, 38, 39, 40, 41, 42, 43, 44, 45, 46]",The Democrats are shambling around like zombies.
