spans,text
"[46, 47, 48, 49, 98, 99, 100, 101, 102]","Because the author with this steaming pile of crap is trying to setup a narrative for the Liberal sheep to follow upon the decision... if it's Bernier, go on and on about his hot biker girlfriend, if it's Leitch, talk about how she's a Trump wannabe and if it's anyone else say ""Joe Who?""...   The Liberals are frankly terrified that anyone of substance will go toe to toe with Mr Potato Head on anything other than Instagram."
"[11, 12, 13, 14, 15]","Calm down, clown."
"[53, 54, 55, 56, 57, 58, 59, 60, 61, 62, 63, 64, 65, 66, 67, 68, 71, 72, 73, 74]","I used to love bike riding but now there are so many social parasites, bums, passed out in the bike path with tons of garbage piled high, it's not worth it."
[],"When the headline reads ""Steve Bannon's porn and meth house"""
"[28, 29, 30, 31, 32, 33]","therein lies the RUB!  when STUPID voters can outnumber the ""smart"" ones, or the smarter ones DON'T VOTE or VOTE UNWISELY, this will always be the result.  if there was only some way to eliminate the ""money"" factor (read:  greed), i'd push it in a heartbeat!"
"[54, 55, 56, 57, 58, 59, 60, 61, 62]",Clinton is an embarrassment to all women of honor and integrity.
"[121, 122, 123, 124, 125, 126, 178, 179, 180, 181, 182, 183, 391, 392, 393, 394, 395, 396]",Some people just need to chill out. Why bring up something that happened years ago? Because of what's going on today you idiots want to dissect on what happened in the past? You idiots are reaching and I mean reaching for something that means nothing. If Janet was a white woman and her right breast was revealed nothing would change. The press would write up the same thing. There are some idiots that still need to evolve.
"[17, 18, 19, 20, 21, 22, 23, 24, 25, 26, 27, 28, 29, 30, 31, 32, 33, 34, 35, 36, 37, 38, 39, 40, 41, 42, 43, 44, 45, 46, 47, 48, 49, 50, 51, 52, 53, 54, 55, 56, 57, 58, 59, 60, 61, 62, 63, 64, 65, 66, 67, 68, 69, 70, 71, 72, 73, 74, 75, 76, 77, 78, 79, 80, 81, 82, 83, 84]","Some people like Merkel are very slow learners and have trouble with logical thinking.  The sad thing is that innocent Germans, and Europeans in general, will pay for her foolish decisions."
"[143, 144, 145, 146, 147, 148, 149, 150, 151, 152, 153, 154, 155, 156, 157, 158, 159, 160]","Hey ms.amylou, you are rude, you call names, you are mean spirited much of the time, as are most Trump supporters.  I haven't seen you telling your nasty buddies to stop their nasty little jabs.  You can start with Nick Travis and waveamaker. 99.9%of the comments I review on here are ""mean spirited"" remarks by Trump supporters so don't presume to lecture me.  Got it?"
[],To the American media this is absolute proof that all white people are racist nazis
"[0, 1, 2, 3, 4]",Gross.
[],No he shot someone so he shouldn't be free. He should be locked up like He is for the next decade. You holla like its no big deal but what if it was your little brother who was shot? Then your dumb ass wouldnrlt be screaming free ace g or whatever gay nickname he has. That is the lamest gangster name ever. Do you think that name scares people? Ace clown is what i will now call him
"[26, 27, 28, 29, 30, 31]","..or maybe just very,very stupid.  Every time Mr Boyle opens his mouth, the story seems to change."
"[12, 13, 14, 15, 16, 17, 18, 19, 20, 21]",You are one sick puppy
[],"I doubt very much that you ""chose"" to be heterosexual. I know that gays do not say, ""I think I will be homosexual. It must be fun to be a member of a despised and persecuted minority.""

And you are still hung up on ""gay sex is icky""."
"[31, 32, 33, 34, 35, 36, 198, 199, 200, 201, 202, 203, 204, 205, 206, 207, 208, 296, 297, 298, 299, 300, 301, 302, 303]","“To those fleeing persecution, terror & war, Canadians will welcome you, regardless of your faith,”the Prime Minister tweeted.
To our Prime Minister it does not matter whether you are a murderer, a drug dealer, a child molester, a criminal etc etc etc
Poorly thought through, naive, immature and ignorant statement from a Prime Minister!
Trying to score cheap political points has consequences!"
"[90, 91, 92, 93, 94, 95, 96, 97, 98, 99, 100, 101, 102, 103, 104, 105, 106, 107, 108, 109, 110, 111, 112, 113, 114, 115, 116, 117, 118, 119, 120, 121, 122, 123, 124, 125, 126, 127, 128, 129, 130, 131, 132, 133, 134, 135, 136, 137, 138, 139, 140, 141, 142, 143, 144, 145, 146]","Donny Trump? I love this guy! Why? Because he throws it right back in the face of all the smug, arrogant and hypocritical  liberals and progressives."
"[15, 16, 17, 18]","Passing on the crap cards that were dealt you to your children, society, and other men's wives is not something anybody should support no matter how much they care about somebodies feelings."
"[17, 18]","This joker - and his ever-shifting team of motley fools - have only been in power for less than a month, and they've already told so many lies they can't keep them straight."
"[80, 81, 82, 83]","While I highly doubt Mr Poplak needs me to defend his writing, I will say that 'fuck' is merely a word - a real word that can be found in the dictionary (right between 'fuchsia' and 'fuddle'), so why should there be a problem with using it for shock and emphasis? And honestly, if someone is going to be that badly affected by reading those four little letters, they're better off not reading Poplak's articles anyway, as he tends to deal with topics that are far heavier than one silly little swear word.

Or to put it another way, as Stephen Fry said: ""If my words offend you, well so fucking what?"""
"[210, 211, 212, 213, 214, 215]","The dispensary  model has been a disaster thus far.  Frequent holdups, adulterated product, and no thought to opening in a suitable location.

The plan for dedicated stores rather than using the LCBO is, like, stupid, but I have more faith in government to do this properly than I do the private sector."
"[143, 144, 145, 146, 147]","Fine clear commentary.  Despite the twaddle in the comments section spreading unverifiable calumny about Hillary Clinton, Trump is a dangerous idiot who needs to be kicked back to the fringes where he belongs.  Hopefully today will do that job."
"[292, 293, 294, 295, 296, 297, 298, 299, 300, 301, 302]","it's understandable why a dead end dead beat like yourself is too embarrassed to post what exactly you have accomplished in life, other than being a troll. I expect a troll like you to flag the post and run like an intellectually bankrupt coward from an intellectually honest debate. You did chickenshit well, troll."
"[29, 30, 31, 32, 33, 34, 43, 44, 45, 46, 47, 48, 49, 50, 51, 52, 53, 54, 55, 56, 57, 58, 59, 60, 61, 62, 63, 64, 65, 66, 67, 68, 69, 70, 71, 72, 73]",is it a loan or a hand out?  stupid Libs.  They need their buts kicked out.  Negligent and careless with our hard working tax dollars.  Wholly incompetent - kick em out of office.
[],Rather than focusing on FEMA'S response to the mayor (as the headline seems to elude) the article and DP continue the narrative of bashing Trump...pathetic and typical liberal DP.
"[0, 1, 2, 3, 4, 5, 6, 7, 8, 9, 10, 11, 12, 13, 14, 15, 16, 17, 18, 19, 20, 21, 22, 23, 24, 25, 26, 27, 28, 29, 30, 31, 32, 33, 34, 35, 36, 37, 38, 39, 40, 41, 42, 43, 44, 45, 46, 47, 48, 49, 50, 51, 52, 53, 54, 55, 56, 57, 58, 59, 60, 61, 62, 63, 64, 65, 66, 67, 68, 69, 70, 71, 72, 73, 74, 75, 76, 77, 78, 79, 80, 81, 82, 83, 84, 85, 86, 87, 88, 89, 90, 91, 92, 93, 94, 95, 96, 97, 98, 99, 100, 101, 102, 103, 104, 105, 106, 107, 108, 109, 110, 111, 112, 113, 114, 115, 116, 117, 118, 119, 120, 121, 122, 123, 124, 125, 126, 127, 128, 129, 130, 131, 132, 133, 134, 135, 136, 137, 138, 139, 140, 141, 142, 143, 144, 145, 146, 147, 148, 149, 150, 151, 152, 153, 154, 155, 156, 157, 158, 159, 160, 161, 162, 163, 164, 165, 166, 167, 168, 169, 170, 171, 172, 173, 174, 175, 176, 177]","This idiot conveniently lumps a whole cast of characters into the ""Religious Right"", It is nothing other than a hit piece on Christians, and I don't care if he was a Bush adviser."
"[14, 15, 16]",Dan you are a nut lol
"[49, 50, 51, 52, 53, 54]",Doubt it ....what's the line from Forrest Gump...stupid is as stupid r's
"[106, 107, 108, 109, 110]","Ok, 306,000,000.00. (Enuff zeros I hope) Yup bills go up to pay it off, what'd we expect, it was free? So silly."
"[186, 187, 188, 189, 190, 191, 192, 193]",Here come the climate change deniers. Neanderthals yearning for simpler times where no one was forced to endure the torture of third grade spelling tests or living in a world where some assholes went to college.
"[82, 83, 84, 85, 86, 87]",As 2 kilos go by unnoticed because a celebrity had a vial with residue in it. Lol idiots.
"[87, 88, 89]","I don't celebrate Christmas, they all became homeless and had to leave, so don't be an ass to me."
[],"Really?  How old are you?  I have been to Puerto Rico numerous times and even hired people from Puerto Rico.  I am not an expert, but I do recall over the past few years that Puerto Ricans tried to assassinate President Truman, shot up the Congress and wounded a few Congressmen.  I recall those perpetrators being released and having a parade in the Puerto Rican neighborhood of NYC.  I recall them being hailed as heroes when they returned to P.R.  I also remember well that there have been three elections in Puerto Rico.   The people had a choice of becoming a state (This would have required them to pay federal taxes.  They never paid a cent.) or to vote Independence or to leave things as they are (Get all the free stuff and benefits from the U.S. just as if the whole island was on federal welfare.).  And you think we have ignored P.R.  Hell man, they drove out the Navy which provided Billions to their economy and thousands of jobs and we ignored them?  What a misinformed fool you are."
"[379, 380, 381, 382, 383]","Excellent straw man. Get everybody yakking about the finances, completely dismissing or ignoring the very real threat underground. The sites could be a cluster of Burj Khalifa-sized derricks, and still not be as ""obtrusive"" as the damage to the environment happening below the surface.

Yes, I'm one of those, not emotionally, but logically - if one of us sh*ts the nest, we all stink."
"[10, 11, 12, 13, 14, 15, 16]","Yet this ""airhead"" has advanced himself as the next Speaker of the House. Lance reached his highest level of competency when he worked as a low-level employee at Sears. Voters should send him back to Sears!"
"[11, 12, 13, 14, 15, 16, 17, 18, 19, 20, 21, 22, 23, 24, 25, 26, 27, 28, 29, 30, 31, 32, 33, 34, 35, 36, 37, 38, 39, 40, 41, 42, 43, 44, 45, 46, 47, 48, 49, 50, 51, 52, 53, 54, 55, 56, 57, 58, 59, 60, 61, 62, 63, 64, 65, 66, 67, 68, 69, 70, 71, 72, 73, 74, 75, 76, 77, 78, 79, 80, 81, 82, 83, 84, 85, 86, 87, 88, 89, 90, 91, 92, 93, 94, 95, 96, 97, 98, 99, 100, 101, 102, 103, 104, 105, 106, 107, 108, 109, 110, 111, 112, 113, 114, 115, 116, 117, 118, 119, 120, 121, 122, 123, 124, 125, 126, 127, 128, 129, 130, 131, 132, 133, 134, 135, 136, 137, 138, 139, 140, 141, 142, 143, 144, 145, 146, 147]","ok, so we sell people killing machines, then we have issue with who they kill... WTF. You sold them a killing machine... your morals are already corrupt."
"[38, 39, 40, 41, 42, 43, 44, 45]","Yeah, sorry, but you're regurgitating bullshit. You want to be a pawn for the rich, fine, but why add to the misinformation?"
"[45, 46, 47, 48, 49, 50, 51, 52]",That old grey mare named  Hillary needs more flogging.
"[228, 229, 230, 231, 232, 233, 234, 235, 236, 237]","Of course any money  Begich did bring to Alaska, was decried as wasteful government spending. But when a Republican does it, like Young, Murkowski, Sullivan, or the late Ted Stevens, it's OK. In fact it's great!
What a bunch of hypocrites you all are."
"[24, 25, 26, 27, 28, 29, 30, 31, 32, 33, 45, 46, 47, 48, 49, 50]","Nice passive aggressive xenophobic comment., coward."
"[790, 791, 792, 793, 804, 805, 806, 807, 808, 809, 810]","ALL of the countries we attacked were better off BEFORE we did so. Iraq had the highest standard of living of any Arab state. Libya had free housing, college, and healthcare. That's better than we've got. Gaddafi was working on a water pipeline to make the country food self-sufficient. MILLIONS of people have died, or been forced into exile as refugees, which has cost our allies in Europe billion$ to deal with, while thousands more have lost their lives in transit. Anyone who says our intentions were good should remember what the road to hell is paved with. We've indebted our children, and their children for over $3 TRILLION to pay for this slaughter, and only made our country LESS safe in the process while causing vast suffering abroad. What goes around WILL come around. Only a fool asks why Muslims hate us. Our actions are why they hate us."
"[117, 118, 119, 120, 121, 122, 123, 124, 125, 126, 127, 128, 129, 353, 354, 355, 356, 357, 358, 359, 360, 361, 362, 363, 364, 365, 366, 367, 368]","Meyer: ""Look at this, will ya!  600 million dollars of reports from the oil companies!  Look - the reports fill this whole freakin' office!  Dang, that's a lot of paper!  This is great!  We can spend millions and millions studying these reports to create more reports!  And reports keep me pulling in my $550 salary.  I love ya Bill Walker!  Yee haw!""

Alaska is doomed."
"[16, 17, 18, 19, 20, 21, 22, 23]","Mr. Trump is an imbecile.  He's an embarrassment to the United States.

Thankfully, his popularity drops every single day.  He's increasingly irrelevant , although his sycophant supporters haven't figured that out yet."
"[52, 53, 54, 55, 56, 57]","Calling tens of millions of voters ""deplorable"" or ""stupid"" (because they voted for the other guy) is condescending. 

But hey, feel free.  It's working so well for you guys."
"[130, 131, 132, 133, 134, 316, 317, 318, 319, 320]","No, she is not the leader for any of the anti-Trump movements...she is just a follower and says, ""me, too"".  So that makes her an idiot looking for a way for her name to go into the Hawaiian history books as one of its senators.

Yes, she will make it into the HawIian history books...it will say she is a ""Me, too, idiot"" senator that did nothing for her constituents."
[],"Cite a source where Muslims are trying to make stoning homosexuals or sluts not crimes in the U.S. And if you need sources of Christians trying to influence our laws based on their dogma, just ask."
"[11, 12, 13, 14, 15]",You are an idiot
"[433, 434, 435, 436, 437, 438]","Yeah, but the so-called president and his cronies want it both ways. He wants to use this in the same way a state-controlled media would be, bypassing the reality-based media, but his buddies (Ryan comes to mind) want to pretend as if what the Donald says on Twitter isn't happening and has no bearing on anything.


His apologists also don't want what this president* says on Twitter to be considered when ruling on things like his stupid and illegal Muslim travel ban."
[],"Agree but I have to say that the jokers in charge of this state are hardly Democrats.  The self-interested monocrats that run this state into the ground are an unique blend of arrogance, incompetence and treachery."
"[42, 43, 44, 45, 46, 47, 245, 246, 247, 248, 305, 306, 307, 308, 309, 310, 311, 312, 313]","The only ones who favor this are educated morons who have never ran a business in their life, have absolutely no idea what it takes to make payroll much less create jobs, because the only thing they have ever ran is their mouth and frankly they suck at that too. Unions are the ones backing this profound stupidity as they are masters at killing business and jobs while bankrupting communities. They are bound and determined to return Oregon to the days we were known as Tax He11, USA and were in recession year after year running high unemployment."
"[11, 12, 13, 14, 15, 16]",Trump is a pu*ssy
"[49, 50, 51, 52, 53, 54]",So what you are saying is that Canadians are too stupid with a short attention span to understand this?
"[51, 52, 53, 54]","If anything, they want full statehood. Yep, it's a dumb analogy."
"[0, 1, 2, 3, 4, 5, 6, 7, 8, 9]","Go to hell, Kellie....not Oxford-debate worthy, but what she and her ideas deserve..."
"[292, 293, 294, 295, 296, 297, 298, 364, 365, 366, 367, 368, 369]","They did use to do both. It was normal corn maze during the day and haunted at night. This is just a strategy for them to see if being kid friendly at night as well would bring in more revenue. I don't think it will. I'm sure next year they will be back to haunting everyone at night. As for dumbass parents taking young children to the haunted night maze, you're idiots in this scenario. That's like complaining to the theater that Texas chain saw massacre was just too scary for my 6 year old girl. OMG."
"[0, 1, 2, 3, 4, 5]",Stupid people strike again.
"[17, 18, 19, 20, 21, 22]","And Trump is too stupid to be president. 

Let's just nullify the last election and hold a do-over."
"[39, 40, 41, 42, 43, 44]","''They must really think Canadians are stupid.'' 

They aren't that far off the mark."
"[0, 1, 2, 3, 4, 5, 6, 7, 8, 9, 10, 11]","Gay marriage will never be approved by the Catholic Church, nor should it be."
"[223, 224, 225, 226, 227, 228, 229, 230, 231, 232, 233, 234, 235, 236, 237, 238, 239, 240, 241, 242, 243, 244, 245, 246, 247, 248, 249, 250, 251, 252, 253, 254, 255, 256, 257, 262, 263, 264, 265, 266, 267, 268, 269, 270, 271, 272, 273, 274, 275, 276, 277, 278, 279, 280, 281, 282]","GBA, you can't be serious. It is your lack of education, flawed logic, and absolute immaturity when it comes to debate that leads to a nation filled with segregation and lack of progress. Your sweeping generalization about studies at the University of Oregon is completely ridiculous. Though the school may lean liberal, there are still countless conservatives on campus that do great things for their respective party. Your maniacal attitude is abhorrent and points to just how much of a keyboard warrior you think you are. 

You are the epitome of what is making the United States a laughing stock. You cannot have a single debate without over-generalizing. But perhaps that may be because the words people use are too big for you. I'm glad you learned the new word 'indoctrinate' today. You've already used it twice. Good for you."
"[7, 8, 9, 10, 11, 14, 15, 16, 17, 18]","what a dummy, dumpy has no regard for the law.  you cannot brutalize a suspect.   he has complete lack of respect for any law and is acting like a dictator.  he is trying to emulate putin."
"[5, 6, 7, 8, 9, 10, 11, 12, 13, 14, 15, 16, 17, 18, 19, 20, 21, 22, 23, 24, 25, 44, 45, 46, 47, 48, 49, 50]","Then let's put the gay men on an island and lesbian women on another and after 100 years see if anyone is left, if it is a natural lifestyle!"
"[55, 56, 57, 58, 59, 60]",See?  What did I tell you.  Hopelessguy belongs in the stupid camp.
"[154, 155, 156, 157, 158, 159, 160, 161, 162, 163, 164, 165, 166, 167, 168, 169, 170, 171, 172, 173, 174, 175, 176, 177, 178, 179, 180, 181, 182, 183, 184, 185, 186, 187, 188, 189, 190, 191, 192, 193, 194, 221, 222, 223, 224, 225, 226, 227, 228, 229, 230]","Krookwell and the City Council are trying to monetize every look at the ocean, every breath you take, every blink of an eye!  They are doing this because they are greedy, corrupt, and incompetent.  Their behavior is just disgusting.  Why did you do this to Hawaii?  WHY??!"
"[18, 19, 20, 21, 22, 23, 24, 25, 26, 45, 46, 47, 48]","Russian patsy, my hairy ass! Go back to your cave, Communist."
"[142, 143, 144, 145, 146, 147, 148, 149, 150, 151, 152, 153]","""growing controversy""

Shouldn't that be ""growing faux controversy""?

Using a grieving mother to make political attacks is typical of sleazy, scum-sucking, liberals."
"[853, 854, 855, 856]","The treatment of the Rohingya Muslims in Myanmar is terrible. Still, it is not difficult to understand why the people of Myanmar want these people out. The Rohingyas cling to a detestable belief that Muslims has an obligation to spread the pure nonsense of Islam to all corners of the world. Without any form of evidence their faith claims that God prefers women to be covered up and kept under strict control. God does not favor men on men, Christians or just about anybody not Muslim. Per the Koran it is okay to kill them all; especially Jews. 

The problem with the Rohingya Muslims, sometimes referred to as the most prosecuted people on earth, has a 
rather obvious solution; they can abandon Islam. 

Of course, this is an impossible task as they have all been indoctrinated in the terrible cult from birth.  They prefer the constant oppression, rape and murder of their people for the simple reason that they lost their capacity for rational thinking."
"[485, 486, 487, 488, 489, 490, 491, 492, 493, 494, 495, 496, 497, 498]","<Kneeling at the national anthem is highly offensive.>
Offensive to whom? The peaceful and lawful exercise of the right to protest ought never be construed as offensive to anyone who loves the Constitution and embraces its values. The sight of some persons kneeling peacefully along side other persons standing peacefully, all in mutual respect, honors the flag in a profound way.
<Criticizing it is Trump's right.>
Absolutely; Trump's rights under the Constitution are neither less nor greater than anyone else's. I suppose he has the right, too, to call the protester a ""son of a bitch.""* However, in doing so, Trump demonstrates his ignorance of and contempt for the Constitution -- as well as his disrespect for the people of the United States.

* I wonder if my direct quote of the president's language, used in public, will get past the Civil Comments process.  What a disgrace it is that this vulgar man is President of the United States."
"[80, 81, 82, 83, 84, 85]",Justin's compntency rating has been downgraded from well-meaning moron to plain stupid.
"[59, 60, 61, 62, 63, 64, 65, 66, 67, 68]",This has to be a joke article.....there are some SERIOUSLY stupid ass people walking this Earth.
[],"Todd, are you sure you teach economics or just MatSu politics?
Your take on SB 91 is based upon a remarkable ignorance of facts."
"[231, 232, 233, 234, 235, 236, 237, 238, 239]","Flippin' riot: that is what it is! HaHa. I almost hate to say it (but I don't), but Lynn Gattis made her own bed. Seniors have kids and other relatives who vote; they are a growing part of the population. Hopefully, a whole lot of stupidity took a bath yesterday."
"[0, 1, 2, 3, 4, 5, 6, 7, 8, 9, 10, 11, 12, 13]","Nazis are scum. Anyone who knows history could never be a Nazi, but sadly they believe an alternative history. Still, they need weapons to gather, and that is wrong; we don't silence with violence. Not only is violence against permitted protestors illegal, it amplifies their message aimed at the alienated and oppressed. More will now join their cause. And no one, but hate leaders wanted that."
"[190, 191, 192, 193, 194, 195, 196, 197, 198, 199, 200, 201, 202, 205, 206, 207, 208, 209, 210, 211, 212]","Trump owes President Obama an apology. 
But we all know he's just going to dig himself in deeper. 
Just as we all know his Trumperbelles are going to scream ""fakes news"" at the top of their idiotic lungs.
Pathetic."
"[12, 13, 14, 15, 16, 17]",that is the stupid post of the year loser. its been oil that has been saving the takers for years.
[],"ANOTHER ""respected community member""?

Just like Bohem, Schwantes and Bill Allen!

And the victims were not believed? 

Alaskans wake up! These are super sick people. They want your daughters and they get away with it cause they are up standing people! THEY ARE SICKO ! 

WHAT CREEP GETS HIS JOLLIES OFF BY HAVING SEXUAL RELATIONS WITH A KID? 

THEY ARE NOT CURABLE. They will always be sick humans."
"[51, 52, 53, 54, 55, 56, 57, 58, 59]",Justin is half competent. That is the scary thing. Imbeciles running the country!
"[24, 25, 26, 27, 28, 29, 80, 81, 82, 83, 84, 85, 86, 87]","Ha!  I get it!  Trump's stupid, and we're clever!  Ha, ha, ha!  Who else can we ridicule?"
"[0, 1, 2, 3, 4]","Silly PP.  The poor have nothing but I guess you'd like to try and squeeze them anyway.  The rich pay more than the middle class, but in percentage of income and amount.  If we all pay the same rate then why shouldn't we all make the same rate. 

""Stealing your hard earned money."" Please PP, enough of the dramatics already."
"[3, 4, 5, 6, 7, 8]",Ok stupid article of the day. Of course it would have helped. A few more seconds to fire rounds amongst all the noise without being able to hear the gunshot.
"[38, 39, 40, 41, 42]",Great column ! ... Only an uninformed idiot could not see the grief that a generation of Cubans have been subjected to.
"[22, 23, 24, 25, 26]",Nothing like a little pussy for stress relief.
"[7, 8, 9, 10, 11, 17, 18, 19, 20]",Such a loser and fool is the infested scrotus. Juvenile and childish don't begin to describe the behavior exhibited on a regular basis. Those who voted him in still haven't reached the embarrassment barrier and likely never will.
"[5, 6, 7, 8, 9, 10, 11, 12, 13, 196, 197, 198, 199, 200, 201, 209, 210, 211, 212, 213, 214]","Your ignorance is showing.  There are country wide bans on docking in places like England.  Their ""AKC"" changed the dog show rules.  I don't know how I feel about this ban but facts are facts and stupid is as stupid does."
[],Sad thing is they generally are just not intelligent.  We now have a president who is the opposite of intelligent.  A loudmouth who increases the volume whenever it gets a bit difficult for him.  This president has done nothing but shoot from the hip.  Sad that you are willing to tolerate it.  May I ask why?  Perhaps you now have a job building that 50 ft wall?  Or one of those manufacturing jobs that has come back to America?  Fact is there is no reason to support this clown.
