spans,text
"[10, 11, 12, 13, 14, 33, 34, 35, 36, 37, 38, 39, 40, 41, 42, 43, 44, 45, 46, 47, 48, 49, 50, 51, 52, 53, 54, 55]","She isn't white?  Ahhh, the old, worn out racist shaming by people who have nothing to say.  I have nothing to say too.  Bye, Bye.  Take your happy pills."
"[20, 21, 22, 23, 24, 25, 26, 27, 28, 31, 32, 33, 34, 35, 36, 37, 38, 39, 40]","Jennifer, you're as dishonest, disgusting and despicable as the evil, vile Hillary Rotten Clinton."
[],"Yeah it's a great conspiracy to make white people ,fat ,dumb and lazy.  It's working!"
"[0, 1, 2, 3, 4, 5, 6, 7, 8, 9, 10, 11, 12, 13, 14, 15, 16, 17, 18, 19, 20, 21, 22, 23, 24, 25, 26, 27, 28, 29, 30, 31, 32, 33, 34, 35, 36, 37, 38, 39, 40, 41, 42, 43, 44, 45, 46, 47, 48, 49, 50, 51, 52, 53, 54, 55, 56, 57, 58, 59, 60, 61, 62, 63, 64, 65, 66, 67, 68, 69, 70, 71, 72, 73, 74, 75, 76, 77, 78, 79, 80, 81, 82, 83, 84, 85, 86, 87, 88, 89, 90, 91, 92, 93, 94, 95, 96, 97, 98, 99, 100, 101, 102, 103, 104, 105, 106, 107, 108, 109, 110, 111, 112, 113, 114, 115, 116, 117, 118, 119, 120, 121, 122, 123, 124, 125, 126, 127, 128, 129, 130, 131, 132, 133, 134, 135, 136, 137, 138, 139, 140, 141, 142, 143, 144, 145, 146, 147, 148, 149, 150, 151, 152, 153, 154, 155, 156, 157, 158, 159, 160, 161, 162, 163]","This DEA agent is still the king of stuck on stupid for shooting himself in the foot in front of children in a classroom.

https://www.youtube.com/watch?v=S7ufT_6Kgy0"
"[57, 58, 59, 60, 61, 62]","He can do it because his primary audience is, in a word, stupid."
"[134, 135, 136, 137, 138, 139, 140, 141, 142, 143, 144, 145, 146, 147, 148]","Better yet, just ask the Islamist basket cases in the West Bank and Gaza. Allah Akbar, anyone? Translation: God is great, now back to sucking on sand and rubble, honor killings, and female genital mutilation."
"[14, 15, 16, 17, 18, 76, 77, 78, 79, 80, 187, 188, 189, 190, 191, 192, 193, 194, 195, 201, 202, 203, 204, 205, 206, 207, 208, 209]","again your an idiot, its not balanced because of OVERSPENDING, it always is loser,, gst tax cuts increased the economy with more people spending more in it.. , now enough with your daily ignorance and stupidity"
"[103, 104, 105, 106, 107, 108, 109, 110, 111, 112, 113, 114, 115, 116, 117, 118, 119, 120, 121, 122, 123, 124, 125, 126, 127, 128, 129, 130, 131, 132, 133, 134, 135]","Whom should we blame then, Christians, Jews, Hindus - the list goes on but at the end of the day it is Muslims who are doing the killing, like it or not."
"[16, 17, 18, 19, 20]",Wht a complete  idiot. I guess we should just outright ban tuna too
"[5, 6, 7, 8, 190, 191, 192, 193, 194, 195, 196, 202, 203, 204, 205, 206, 207, 208, 209, 210, 211]",Your damn right it is sad who are the traitors and liars that run these papers. I used to love and admire the globe no goddamn longer that's for sure. Nothing but bias . I am really worried Muslims and communists are going to overrun this great nation with help from Justin Trudeau and his band of merry Ho Ho's. Liberals are no longer the reasonable people they used to be . Stand up Canada .Before it is too late . Hoist a weapon if you have to but lets get rid of this politically correct band of rich zealots parading new world order under disguise of tolerance.
"[28, 29, 30, 31, 32, 33, 34, 35, 85, 86, 87, 88, 89, 90, 102, 103, 104, 105, 106, 107, 171, 172, 173, 174, 175, 176, 362, 363, 364, 365, 366, 367, 368, 369, 370, 371, 372, 373, 387, 388, 389, 390, 391, 392, 393]",Don't like it you can leave d*ckhead. No one is forcing you to be here. I cant stand idiots like you. Idiota like you thibk Hick is going set Dunlap free. Tbats shows how stupid you truly are. If anything he will commute his sentence to life.which is harsher sentence then the death penalty but you republicans talk a big bad game but at the end of the day your bloodthirsty like actual killers. Get out of my state you redkneck
"[67, 68, 69, 70, 71, 72, 73, 74, 75]",Then you are not the real Ronnie Ching.  I cannot help you in your ignorance.
"[52, 53, 54, 55]","ah, they are pigs and parents are likely the same, ""pigs"", just say it Elizabeth!"
"[62, 63, 64, 65, 66, 67, 68, 69, 70, 71, 72, 73, 74, 75, 76, 77, 78, 79, 80, 81, 82, 83, 84, 85, 86, 87, 88, 89, 90, 91, 92, 93, 94, 95]",jrutcliffe..  it sucks that its not 1950 any more doesn't it. Get those women back doing laundry...
"[135, 136, 137, 138, 139, 140, 141, 142, 143, 144, 145, 146, 147, 148, 149, 150, 151, 152, 153, 154, 155, 156, 157, 158, 159, 160, 161, 162, 163, 164, 165]","What, pray tell, is the exit strategy?  Answer: None.  After 3 years, recipients will fee entitled to this higher sum, and want more!  Ontario Liberals screw up again."
"[24, 25, 26, 27, 77, 78, 79, 80, 81, 82]",How they all end up.....dead....not in heaven but to burn in HELL where they belong!
"[19, 20, 21, 22, 23, 24]",Water does not put mercury into the water - you are some severely dumb people HYDRO IS WATER.
"[22, 23, 24, 25, 26, 27, 28, 29, 30]","such blatant partisan hypocrisy, myopia, and outright disregard for history or decency is another laughable display of futility in reasoning with the finger pointing trump fan club. it's anything goes as long as it's their guy."
"[150, 151, 152, 153, 154]","i used to wonder who don jr REAL dad was - he doesn't look like trump or ivanna.. but he showed himself to be a chip off the old block. a liar and an idiot,,,just like good ole dad..."
"[15, 16, 17, 18, 19, 20]",You  can't fix stupid. And now I don't even try.
"[135, 136, 137, 138, 139, 140, 141, 142, 143, 144, 145, 146, 147, 148, 149, 150, 151]","lukecanada writes:

""yet it is you left wing lunatics that love totalitarianism, with your love of dictators etc""

--

Being called a ""left-wing lunatic"" by lukecanada is one of the highest compliments I can think of."
"[8, 9, 10, 11, 12, 13, 14, 15, 16, 424, 425, 426, 427, 428, 429, 430, 431]","aa more ignorance, see pal the usa is the single most valuable market of all countries and such all the others covet to sell in the usa far more than the usa does to sell outside of itself.. the profit industry indeed wants into the usa market more than any other period.. and cash is not based on some alt left fantasy about clean, its about profits,, such fantasies about clean to define making money is an example of the ignorant incompetent brain washed left winger.."
"[248, 249, 250, 251, 252, 253, 254]","Literally, every leader of every single industrialized nation except ours, is competent. They must feel like we've lost our minds with trump at the helm. One thing for certain, we will lose our status as the most powerful nation quickly under this buffoon."
[],"Final? Sure. But Punishment? Nope.
Suicide was the easy way out for this scumbag."
"[163, 164, 165, 166, 167, 168, 169, 170, 171, 172, 173, 174, 175, 176, 177, 178, 179, 180, 181, 182, 183, 184, 185, 186, 187, 188, 189]","Unless you have lived in generations of harvesting fish, either subsistance, commercial or sport fishing, you will never know the importance of ""The way of life."" So shut your ignorant mouth."
"[24, 25, 26, 27, 28, 29, 30, 31, 32]","He's a complete a total hypocrite.  He writes an article about Trump making a claim with no proof that was parroted by ""fake news"" sites.  When it's brought to his attention that the mainstream media does the exact same thing and did it throughout the entire election, he just shrugs his shoulders and says ""meh.""  There is a difference, but not one he can define and quantify.  He cites the SPJ code of ethics but then we demonstrate the establishment media doesn't even meet that criteria and he of course has no response.
Real journalists, like Green Greenwald, have tirelessly exposed this media narrative time and again.  If only we had real journalists at Civil Beat.  Pierre should get rid of it and just make an Intercept Hawaii bureau with real journalist.

""Those who most loudly denounce Fake News are typically those most aggressively disseminating it.""

https://theintercept.com/2016/12/09/a-clinton-fan-manufactured-fake-news-that-msnbc-personalities-spread-to-discredit-wikileaks-docs/"
"[126, 127, 128, 129, 130, 131, 259, 260, 261, 262, 263, 264, 265, 266, 267, 268, 269, 270, 271, 272, 273, 274, 275, 276, 277, 278, 279, 280, 281, 282, 283, 284, 285, 286, 287, 288, 289, 290, 291, 292, 293, 294, 295, 296, 297]","Someone doesn't know her history.  AOL didn't pay it's 'forum manager' a cent.  THEY paid to use AOL.  Even today, sites like reddit (a for profit entity) do not pay moderators.

She's gonna lose and, hopefully, she's going to have to pay THEIR legal fee's.  No excuse for being ignorant of history."
"[146, 147, 148, 149, 150, 151]","Just because his name was Smoke doesn't mean we need a SMOKESCREEN around his totally unnecessary death!  End the Iditarod and all other similar, stupid, pointless, cruel, greed/ego-driven dog races"
"[19, 20, 21, 22, 23, 24, 25, 26, 27, 28, 29, 30, 31]","Go back to Mexico, blow-hard Fox. We don't want you here. Take your illegals back with you."
"[15, 16, 17, 18, 90, 91, 92, 93, 94, 95, 96]","What a pile of shit.
I love Bruce and I could write a better case against Bruce than this rubbish !"
"[290, 291, 292, 293, 294, 295, 296, 297, 298, 299, 300]","Many misguided and misinformed people on this site criticize the President calling him a draft dodger.  However, the rank and file in the military as well as veterans voted overwhelmingly for Trump.  Now the Dumbo Dems criticize him because he has too many military people in the cabinet.  What idiots!"
"[13, 14, 15, 16, 17, 18, 19, 20, 21, 22, 23, 24, 25, 26, 27, 70, 71, 72, 73, 74, 75, 76]",What a truly useless country and being supported by an ex East German bumbler who is leading socialist Europe as the Hamelin piper did.
"[26, 27, 28, 29, 30, 31]","... she has that ""serious hooker"" look down pay..."
"[55, 56, 57, 58, 59]","way to set an example for the world to see.
Trump is a idiot"
"[74, 75, 76, 77, 78, 79, 80, 81, 82, 83, 84, 85, 86, 87, 88, 89, 90]",It's for sure that trawling doesn't help.  It's all man made in the end.  Humans are stupid.
"[21, 22, 23, 24, 25, 26]",Why do so many local idiots hate hikers so much?
"[146, 147, 148, 149, 150, 151, 152]",I believe that you would want one of the best payers in the NFL promoting your car dealership unless he devalued himself by participating in this idiotic protest.
"[209, 210, 211, 212, 213, 214, 215, 216, 217, 218, 219, 220, 221, 222, 223, 224, 225, 226, 227, 228, 229, 230, 231, 232]","Much like the Americans the French people are ""damned if you do...."". Choosing between a candidate who's main campaign promise is staying the course (despite people being unhappy with it) and a seemingly less than competent candidate ..."
"[0, 1, 2, 3, 4]",Moron
"[152, 153, 154, 155, 156, 157, 158, 159, 160, 161, 162, 163, 164, 165, 166, 167, 168, 169, 170, 171, 172]","Yeah that gun ran around and shot people.....
When the terrorists come into the mall, I hope you are standing there taking the fire for me as I reload.
You'll be in a coffin and I'll be a hero....
I'd rather be the latter protecting my family 
thanks for taking the bullets BTW"
"[158, 159, 160, 161, 162, 163, 164, 165, 166]","China gave it's reply. Russia gave it's reply months ago. Iran gave it's reply years ago.

It isn't up to them, it is up to you. Do you have the guts and the stupidity?"
"[0, 1, 2, 3, 4, 5, 6, 7, 8, 9, 10, 11, 12, 13, 14, 15, 16, 17, 66, 67, 68, 69, 70, 71, 72, 73, 74, 75, 76, 77, 78, 79, 80, 81, 82, 83, 84, 85, 86, 87, 88, 89, 90, 91, 92, 93, 94]","Spare us this crap, please.  I can just as easily and pointlessly accuse you of being Ukrainian.  It's silly to think Russians are bothering with the Globe and Mail."
"[53, 54, 55, 56, 57, 58]","Yep, and it's also time for cyclists to not act like idiots when they're on the road."
"[98, 99, 100, 101, 102, 103, 104, 105, 106, 107, 108, 109, 110, 111, 112, 113, 114, 115, 116, 117, 118, 119, 120, 121, 122, 123, 124, 125, 126, 127, 128, 129, 130, 131, 132, 133, 134, 135, 136, 137, 138, 139, 140, 142, 143, 144, 145, 146, 147, 148, 149, 150]","Gee when it was Wonder Woman a couple of weeks ago, it was the best thing going to empower woman. Now becausE it's the wrong gender for these feminists, it's deplorable.
Unbelievable."
"[16, 17, 18, 19, 20, 21]",Nice to see the tyrant handled easy.  Good job Cal.
"[0, 1, 2, 3, 4, 5, 6, 7, 8, 9, 10, 11, 12, 13, 14]","Pathetic weasel, censor's-pet."
"[53, 54, 55, 56, 57, 58, 59]","Everyone has moments they shine and others they look foolish. I try to remember that just because I REALLY don't agree with a poster on one topic, there I am agreeing with them on another the next day. Go figure."
"[33, 34, 35, 36, 37, 38]",Does anyone really care if these clowns leave as there are many more with intelligence who are waiting to join.
"[182, 183, 184, 185, 186, 187, 188, 189, 190, 191, 192, 193]",Zuri your a shoe in for that OHA position you applied for - you sure are working hard to get it by kissing a lot of OHA bottom (which when you think of where that bottom has been is pretty gross).
"[47, 48, 49, 50, 51]","""is he still (a) evil-incarnate; (b) a corrupt idiot and/or (c) a Russian stooge""
(a) no.
(b) yes.
(c) jury is still out. Leave Trump in a room alone with Putin, and Russia will have a warm-water port in Hawaii."
"[14, 15, 16, 17, 18, 27, 28, 29, 30, 31, 32, 33, 34, 35, 36]",I too tire of those meanie Dummycrats hurting our friend Putin's fee-fees.
"[15, 16, 17, 18, 19]","You blithering idiot. Why wasn't the shooter arrested when he turned himself in? You're weak, shut your hell mouth."
"[43, 44, 45, 46, 47, 64, 65, 66, 67]",Consider it the penalty for working with a loser like President Dump.
[],"A PROVEN LIAR saying someone else is not telling the Truth? Implausible, in-imaginable and totally unlikely for ANYONE other than a dTrump0 to 'tell a lie about something so important'. 100% belief-factor to the Widow....and a whopping -394% to the immature, puerile, sociopath, bully-boy President of the USA!  Hey, even Clinton had more guts than D-Goofball 2017...at least he finally admitted that he lied about getting a blow job from Monica!"
"[24, 25, 26, 27, 28]","Just can't wait for the idiot in chief's next 'woe is me tweet"". This is what happens when you put idiots in a circle and tell them to shishi in the corner."
"[252, 253, 254, 255, 256, 257]",Cleaner air.... from a guy who drives a big Ford diesel.....LOL...hey buddy we are all laughing at you.   I a surprised you are a reader of the G and M..Thought the local Sun rag would be more of your IQ rating.  You do have a post doctorate degree in idiocy dont you??
"[29, 30, 31, 32, 33, 34, 35, 36, 37, 38, 39, 40, 41, 42, 43, 44, 45, 46, 47, 48, 49, 50, 51, 60, 61, 62, 63, 71, 72, 73, 74, 75, 76, 77, 78, 79, 80, 81, 82, 83, 84, 85, 86, 87, 88, 89, 90, 91, 92, 93]","Quarantine should end with a bullet between the eyes.  What crap to be attacked by a loose dog.  I hate it when a loose dog comes running up, and the owner says he is friendly.  Bear spray to the face"
"[159, 160, 161, 162, 163, 164, 165]","You are right.... couldn't get past the part where he talks about grabbing pussy, where he makes fun of the disabled,where he talks about building a wall, and kicking out Muslims.  How can you love this country if you do all that?"
"[265, 266, 267, 268, 269, 270, 271, 272, 273]","""You won’t find the PM attacking his domestic political adversaries in this or any other international media,

but you do see Wynne and Trudeau's political aide including Gerald Butts himself attacking the then PM Harper on international media. 

Butts is a clever hypocrite."
"[229, 230, 231, 232, 233, 234]","WOW - Your arrogance just exceeded your ignorance today! Pick Texas and compare it to Hawaii by a bone headed statement? The post you were replying to was about poor government and high taxes, so your Texas analogy is just plain stupid..."
[],"Some of us remember your cracked pot posts about Harper as obvious manifestations of Harper Derangement Syndrome.

And if you are going to post the same childish and stupid and tedious TDS accusation every time someone posts a negative comment - whether provable or just reasonable opinion - then it is obvious to all that YOU are the tiresome troll who needs to get some help.

I guess inasmuch as you are a left wing, Trudeau worshipping troll, you'll get away with this moronicity here.

Pity."
"[145, 146, 147, 148, 149, 150, 151, 152, 153]","Jantjies must go, I agree. Gets caught with ball too much, hardly ever breaks, not agile or fleet footed. 
The game was lost however by one mans stupidity, D'Allende, who is also showing none of his early brilliance. In fact, our centers all around are lacking, and it's not form. They seem to think they're battering rams.
Etsebeth was brilliant, but I hope the captaincy doesn't detract.
An altogether better performance as a whole."
"[26, 27, 28, 29, 30, 31, 32, 33]","my god you are incredibly ignorant, developed in the USA pal, get over it"
"[31, 32, 33, 34, 35, 36, 37, 38, 39, 40, 41, 42, 43, 44, 45, 46, 47, 48, 49, 50, 51, 52, 53, 54, 55, 56, 57, 58, 59, 60, 61, 62, 63, 64, 65, 66, 67, 68, 69, 70, 71, 72, 73, 74, 75, 76, 77, 130, 131, 132, 133, 134]",look we cannot to take on more syrians that are not well educated or inclusive.  Trump has a different agenda.  Justin is just an idiot. Why is Canada always last?
"[37, 38, 39, 40, 41, 42, 43, 44, 45, 46, 47, 114, 115, 116, 117, 118, 119, 120, 121, 122, 123]","I prefer his more progressive title- Potato Head. It fits him much better than ""Prime Minister Trudeau"", which is nauseating."
"[284, 285, 286, 287, 288, 289]","The jc hospital is a lawsuit waiting to happen, mental health in eugene is treated worse than prison. How dare the city take life from people in the land of the free because you do not take the time to understand individuals. Its a pitiful shame to force people on drugs because your stupid."
"[201, 202, 203, 204, 205, 215, 216, 217, 218, 219]","Probably Trump's attack was illegal. It may even be a source of regret in years to come for the precedent that it has set. Still, Assad's crimes are monstrous and he has it coming. The strike on Syria shows that an idiot can do the right thing, possibly even for the wrong reason. The sooner the Assad regime is destroyed, the better."
"[39, 40, 41, 42, 43, 44]","Poor Edward, even his family think him stupid"
"[0, 1, 2, 3]",Damn! A miserable waste of oxygen such as this guy make it difficult to oppose the death penalty on principle.
"[52, 53, 54, 55, 56, 57]","U suck my will to live with your idiotic, childish, stupid, finger pointing waste of breath - if I am in your house or car and leave my gun I guess that would make you another neato gun owner. Can't wait."
"[0, 1, 2, 3, 4, 5, 6, 7, 8, 9, 10, 11, 12, 13, 14, 15, 16, 17, 18, 19]","The only liar is you.  If you agree with Wilson an opportunist bottom feeder, that says more about you and your world view."
"[3, 4, 5, 6, 7, 8, 9, 31, 32, 33, 34, 35, 36, 37, 38]",40 bitches?  These people have no ethics.
[],"Typical marxist
You in fact are a pimple o n the ass of a fly but the elites use your insanity to incite hatred.
Look at you
You are shamed"
"[4, 5, 6, 7, 8]","Any idiot could compromise their ethics and choose one of these two.  Heck, I could, if I wanted to be so lazy to do so.  The intelligent people see past the bread crumbs that are thrown at the mass of ignorants and understand really what this country needs."
"[203, 204, 205, 206, 207, 208]","You think this is bad, wait till they start raising property taxes to help pay for the man made disaster called The Rail.  Landlords will pass the increase on to renters and walla...more homeless.  What idiots."
"[183, 184, 185, 186, 187, 188, 189, 190]","Well said, frankA.  Still, I believe even your well reasoned post gives the gang of four too much credit.  They all but threaten schism if they don't get their way.  These four are a disgrace."
"[322, 323, 324, 325, 376, 377, 378, 379, 380, 381, 382]","Still waiting for your ""complete knowledge"".  That's the problem with FUD, you can't back up your own BS with any sources.  My guess is that you're a Lockheed shill and you think that your FUD will influence Canadians.  The problem is that the average Canadian, unlike the average American has an education that's worth a damn and we know what goes on around the world.  Your useless rhetoric won't sway anyone north of the border."
"[47, 48, 49, 50, 51, 57, 58, 59, 60, 89, 90, 91, 96, 97, 98, 99, 100, 101, 102, 103]",wow.....slap on the wrist for watching someone abuse and kill your child? She is just as bad as murderer and should rot in jail.
"[40, 41, 42, 43, 44, 45, 118, 119, 120, 121, 122, 123, 124, 125, 126, 127, 128, 129]","So the women that voted for him are too stupid to know better.....I believe that they do know,  and they don't need a giant vagina on their head to prove it!"
"[34, 35, 36, 37, 38, 39]",That's why Trump keeps doing such stupid stuff.  To get the media against him and increase how much his followers love him.  It's all planned. Yup.
"[272, 273, 274, 275, 276, 277, 283, 284, 285, 286, 287]","If trump shows up for the debates, I'll be surprised. He's already trying to back out of them. He lied about the NFL complaining about the scheduling of the debates.  The NFL said they sent no such letter. He's accused Clinton of setting the dates. That was a lie. He's a coward and whiny little boy. He knows he'll get his butt kicked in the debates. I'd put money on him wimping out."
"[45, 46, 47, 48, 49, 50, 51, 52]","Well, this sounds like more liberal democrat bullshit."
"[41, 42, 43, 44, 45, 46, 47, 48, 49]","The teen activists are fine, ….it's your stupidity that's monumental."
"[47, 48, 49, 50, 51, 52]","nick, please reread your posts. If you do, the stupid and ignorant one might become clear to you......nah.....forget it. It won't happen."
"[8, 9, 10, 11, 12, 13, 14, 15, 16, 17, 18, 19, 20]",Rabidly anti-Canadian troll.
"[27, 28, 29, 30, 31, 32, 33, 34, 35]",The depth of ignorance and stupidity knows no bounds in this disgusting batch of ectoplasm currently fouling our governing system.
"[0, 1, 2, 3, 4, 5]","stupid piece, left wing love the dictators!!!"
[],We are sending help because that's what neighbours do when neighbours are in trouble.  Just like the U.S. and other countries sent help in dealing with the Fort McMurray fires and countless other natural disasters here at home.  Only a misanthropic jackass would find fault with that.
"[74, 75, 76, 77, 78, 79, 80, 81, 82, 302, 303, 304, 305, 306, 307, 308, 309, 310, 311]","It will be perfectly appropriate when the human race, through neglect and stupidity, brings about its own extinction. The devout will mutter, ""It's God's will,"" the atheists will insist, ""There's no God to fault,"" and other living creatures (apes, beavers, your dog or cat) will frown at us and spit, ""You idiots!"""
"[211, 212, 213, 214, 215, 216]","Well, with cantwell - the blowhard from the VICE documentary now currently bawling like a baby due to an arrest warrant, the pizza dude and the hot dog dude losing their jobs, I think a lot of the 'master race' losers moving back home, if their parents will have them. Whole lotta losers thought they'd be untouchable."
"[21, 22, 23, 24, 25, 26, 27, 28, 29, 30, 31, 32, 33, 34, 35, 36]","Oh, my globe did you Islamic dictator have you
remove my post. Tsk, tsk, must be you hanging
on a commies coat tails. Are you afraid they'll
slap you on the pee, pee."
"[167, 168, 169, 170, 171, 172, 173, 174, 175]","Don't worry lefty, you and your ilk will all be in Florida this year.
A non union state that has always be Republican!! 
Make sure you get a good deal to go with your hypocrisy."
"[82, 83, 84, 85, 86, 87, 150, 151, 152, 153, 154, 155, 156, 157, 158, 159, 160, 161, 162, 226, 227, 228, 229, 230, 231]",sure looks like it and your post is the first to ask the question amongst all the idiots blaming it on one political party or another.  Some sicko is killing pairs around Anchorage and the FBI has been called in.  Yet all the idiots want to blame the few politicians willing to run the city; either party.
"[373, 374, 375, 376, 377, 378]","The proposed bill is outrageous - full stop.

But the alt-right losers' naturally just hone right in on their usual unsubstantiated, borderline fake news ad hominem attacks on Trudeau; falsely labeling him as a snowboard instructor (Stephen Harper's only real job was as a mail room clerk, yes?) or drama teacher (he was primarily a math and French language teacher).

Hey idiots - the ""just not ready"" narrative blew up in your faces once already - keep your eyes on the ball, eh?"
"[8, 9, 10, 11, 12]","Shut up loser,  smoke another bowl."
"[454, 455, 456, 457, 458, 459, 460, 461, 462, 463, 464]","Deplorable liar, hypocrite, demagogue of a militant ideology against the world in wrathful avarice-poisoned pursuit of oil and war profit, paid for in the blood and misery of innocent millions abroad and US domestic enslavement to US$19.978B in wrongful war debt. All on a false presence. The war criminals Cheney and Bush and their collaborators still go at large, still escape the justice of the Hague. It's an affront to civilization itself, and this clown-beast claims to represent the right side of history?"
"[17, 18, 19, 20, 21, 22]",Stupid leftists. Stupid Democrats. I sincerely believe they wouldn't have won many elections without fraud. This kind of stuff shines the light brightly on them.
"[15, 16, 17, 18, 19, 20]",Read the whole damned story and stop cherry picking to suit your point of view.
"[18, 19, 20, 21, 22, 23]",This lady is just stupid. Always get multiple opinions if doing elective operations. I would recommend against elective operations for the most part.
"[0, 1, 2, 3]",Kill rail and turn it into an elevated roadway for buses and cars that pay . Oh that's right no more Common sense left in Hawaii.
